{"baseRevision":"cf0a02e6586e3197d50b117a84094e94f81a8e85","claims":[{"anchorProfile":"python-docstring/1","associationKind":"PYTHON_DOCSTRING_FUNCTION","associationState":"ASSOCIATED","authorityClass":"CALLER_REPORTED","claimId":"claim:sha256:4e8d0663d78cd2dbd656b0dc67fc47d5e3dac6fb8a32e8a63c3c327cc14d4130","executionKeySha256":"298cb91cfe64c88a2a61d264fa9d2f8aaf0dec2c7533e9a609217136ebccbb51","hygieneState":"ELIGIBLE","obligationId":"TCQ-CONF-001","reasons":["test-not-matched"],"relation":null,"reportState":"NOT_MATCHED","rowIds":[],"testUnitId":"test-unit:sha256:7bcf0fe838810115b192a44315757fa54c45ba6880cb0f39f16f2be599844817"}],"commandId":null,"id":"tcq:sha256:a3c1913fbc99813912ee8366dcc62cb5c66ca84dd5bdfbbfa6c0206302084e34","issues":[{"claimId":"claim:sha256:4e8d0663d78cd2dbd656b0dc67fc47d5e3dac6fb8a32e8a63c3c327cc14d4130","obligationId":"TCQ-CONF-001","reason":"test-not-matched"}],"observation":null,"ocmSha256":"4b31cbb8b8e8d4d87f880e4a954a0f9d15311685b74379ae1f9d6a8489194348","profile":"tcq/0","targetRevision":"59cf4f6560ad25e420d3b06e05c09b452936e7e1","units":[{"blobOid":"bb80378cda44bf34b68e111858f3b0daeeb93910","bodySha256":"b4196abb13b0128a0f63fbc9fb4350e8c8ba0a24c3ab0f78c49cd5878f580dcc","bodySpan":{"end":78,"start":30},"executionKeySha256":"298cb91cfe64c88a2a61d264fa9d2f8aaf0dec2c7533e9a609217136ebccbb51","extractorProfile":"python-ast/1","id":"test-unit:sha256:7bcf0fe838810115b192a44315757fa54c45ba6880cb0f39f16f2be599844817","path":"tests/test_app.py"}]}
